{
  "schema_version": "1.1.0",
  "receipt_id": "RECEIPT-HOSTED-POSTGRESQL-001",
  "claim_id": "CLAIM-HOSTED-SYNTHETIC-DATABASE-BOUNDARIES",
  "intended_use_id": "INTENDED-USE-SYNTHETIC-REFERENCE",
  "release_claim_id": "RELEASE-CLAIM-IMPLEMENTATION-0.3.1",
  "evidence_mode": "observed",
  "assurance_stage": "verified",
  "environment": "github-hosted-synthetic-postgresql",
  "version_bindings": {
    "repository": "0.3.1",
    "repository_commit": "205401a530e984e031bb2c52a1654c6b5f82bc6d",
    "workflow_run": "https://github.com/driftframestudios/lims-eln-enterprise-implementation/actions/runs/33581976426",
    "python": "3.12.14",
    "postgresql": "17.10-alpine",
    "database_migration_head": "005",
    "tenant_authority": "signed_short_lived_database_verified_context",
    "flyway": "13.0.0",
    "flyway_image": "flyway/flyway:13.0.0-alpine@sha256:f3c8433401abf859ef9022584c8e6111684363ec490f737e749e9a4705ea32d0",
    "migration_authenticated_login": "laboratory_migrator",
    "migration_role": "laboratory_owner"
  },
  "scenario_ids": [
    "SCN-DB-MIGRATION-CHECKSUM-REPLAY",
    "SCN-DB-MIGRATION-003-TO-004-UPGRADE-REPLAY",
    "SCN-DB-MIGRATION-004-PROVENANCE-GATE",
    "SCN-DB-SIGNED-TENANT-BOUNDARY",
    "SCN-DB-TENANT-CONTEXT-TAMPER-EXPIRY",
    "SCN-DB-CUSTODY-CAS-AND-ATOMIC-OUTBOX",
    "SCN-DB-SECURITY-DEFINER-TEMP-SHADOW",
    "SCN-DB-OUTBOX-CONTENT-IMMUTABILITY",
    "SCN-DB-OUTBOX-FENCED-CLAIM-RECLAIM-STALE-CONFIRM",
    "SCN-DB-OUTBOX-LEASE-DURATION-INTEGER-BOUND",
    "SCN-DB-OUTBOX-MESSAGE-IDENTITY-LIVENESS",
    "SCN-DB-OUTBOX-TRANSITION-AUTHORITY",
    "SCN-DB-OUTBOX-ATTEMPT-ACK-RECOVERY-EVIDENCE",
    "SCN-DB-OUTBOX-TRANSPORT-RECEIPT-UNIQUENESS",
    "SCN-DB-SCIENTIFIC-QUANTITY-EXACTNESS",
    "SCN-DB-VERIFICATION-KEY-CONFIDENTIALITY",
    "SCN-DB-FLYWAY-MIGRATOR-AUTHORITY",
    "SCN-DB-FLYWAY-ARTIFACT-INVENTORY",
    "SCN-DB-MIGRATION-CLEAN-UPGRADE-CONVERGENCE",
    "SCN-DB-MEASUREMENT-COMPLETE-LINEAGE",
    "SCN-DB-CUSTODY-COMPLETE-EVENT-BINDING",
    "SCN-DB-WORKBENCH-RESTART-RELOAD",
    "SCN-DB-WORKBENCH-REPLAY-COLLISION-ISOLATION",
    "SCN-DB-WORKBENCH-ROLLBACK-RETRY",
    "SCN-DB-WORKBENCH-INSTRUMENT-RECOVERY",
    "SCN-DB-WORKBENCH-DECIMAL-SOURCE-SHAPE",
    "SCN-DB-WORKBENCH-CANONICAL-DIGEST"
  ],
  "artifact_digests": [
    "sha256:8ebb58455b8db070c8f13b871401bcea9bb630af57a94605e61105f5d89ff1ea",
    "sha256:a4fafe7ebb50da1efbad47df24d6d7af741130039ba8c90b8d6457e9d1d107b9",
    "sha256:8bbada0ceaa11f264d2d6ad4c893abd8b4313482da387401fd9b0f1d0106666a"
  ],
  "observed_at": "2026-09-02T02:08:40Z",
  "performer_id": "GITHUB-ACTIONS-HOSTED-RUNNER",
  "reviewer_id": "SYN-INDEPENDENT-DATABASE-CONVERGENCE-SUITE",
  "limitations": [
    "This receipt establishes the synthetic hosted PostgreSQL 17 migration, durable workbench, and upgrade-replay paths for the named commit; production authorization remains with accountable environment owners.",
    "PostgreSQL 18.6 compatibility was observed locally and remains outside this hosted coordinate.",
    "Representative populated migration and restore rehearsal retains its independent successor receipt.",
    "Production security and observability evidence retains its independent successor receipt.",
    "Accountable Scientific, Quality, and Regulatory acceptance retains its independent successor receipt."
  ]
}
