{
  "schema_version": "1.1.0",
  "receipt_id": "RECEIPT-HOSTED-POSTGRESQL-RESOURCE-CLEANUP-001",
  "claim_id": "CLAIM-HOSTED-SYNTHETIC-DATABASE-BOUNDARIES",
  "intended_use_id": "INTENDED-USE-SYNTHETIC-REFERENCE",
  "release_claim_id": "RELEASE-CLAIM-IMPLEMENTATION-0.3.2",
  "evidence_mode": "observed",
  "assurance_stage": "verified",
  "environment": "github-hosted-synthetic-postgresql",
  "version_bindings": {
    "repository": "0.3.2",
    "repository_commit": "ae213e7c01262431030a2a8d81129bed090f1376",
    "workflow_run": "https://github.com/driftframestudios/lims-eln-enterprise-implementation/actions/runs/38761716006",
    "python": "3.12.15",
    "psycopg": "3.3.6",
    "postgresql": "17.10-alpine",
    "postgresql_image": "postgres:17.10-alpine@sha256:742f40ea20b9ff2ff31db5458d127452988a2164df9e17441e191f3b72252193",
    "database_migration_head": "007",
    "tenant_authority": "signed_short_lived_database_verified_context",
    "flyway": "13.8.1",
    "flyway_image": "flyway/flyway:13.8.1-alpine@sha256:ca3c8eddac25811f84c9767c56a0610ce23cd4e61f59bb05778a78db42347b39",
    "migration_authenticated_login": "laboratory_migrator",
    "migration_role": "laboratory_owner",
    "runner": "ubuntu-24.04",
    "workflow": ".github/workflows/ci.yml",
    "clean_job_id": "116514428880",
    "upgrade_job_id": "116514429586",
    "plan_observation_artifact": "receipts/postgresql-resource-cleanup-plan-observations.json",
    "predecessor_receipt": "RECEIPT-HOSTED-POSTGRESQL-V007-001",
    "clean_job_conclusion": "success",
    "upgrade_job_conclusion": "success",
    "source_workflow_conclusion": "failure",
    "source_metadata_state": "awaiting_successor_receipt_admission"
  },
  "scenario_ids": [
    "SCN-DB-MIGRATION-CHECKSUM-REPLAY",
    "SCN-DB-MIGRATION-003-TO-007-UPGRADE-REPLAY",
    "SCN-DB-MIGRATION-004-PROVENANCE-GATE",
    "SCN-DB-SIGNED-TENANT-BOUNDARY",
    "SCN-DB-TENANT-CONTEXT-TAMPER-EXPIRY",
    "SCN-DB-CUSTODY-CAS-AND-ATOMIC-OUTBOX",
    "SCN-DB-SECURITY-DEFINER-TEMP-SHADOW",
    "SCN-DB-OUTBOX-CONTENT-IMMUTABILITY",
    "SCN-DB-OUTBOX-FENCED-CLAIM-RECLAIM-STALE-CONFIRM",
    "SCN-DB-OUTBOX-LEASE-DURATION-INTEGER-BOUND",
    "SCN-DB-OUTBOX-MESSAGE-IDENTITY-LIVENESS",
    "SCN-DB-OUTBOX-TRANSITION-AUTHORITY",
    "SCN-DB-OUTBOX-ATTEMPT-ACK-RECOVERY-EVIDENCE",
    "SCN-DB-OUTBOX-TRANSPORT-RECEIPT-UNIQUENESS",
    "SCN-DB-SCIENTIFIC-QUANTITY-EXACTNESS",
    "SCN-DB-VERIFICATION-KEY-CONFIDENTIALITY",
    "SCN-DB-FLYWAY-MIGRATOR-AUTHORITY",
    "SCN-DB-FLYWAY-ARTIFACT-INVENTORY",
    "SCN-DB-MIGRATION-CLEAN-UPGRADE-CONVERGENCE",
    "SCN-DB-MEASUREMENT-COMPLETE-LINEAGE",
    "SCN-DB-CUSTODY-COMPLETE-EVENT-BINDING",
    "SCN-DB-WORKBENCH-RESTART-RELOAD",
    "SCN-DB-WORKBENCH-REPLAY-COLLISION-ISOLATION",
    "SCN-DB-WORKBENCH-ROLLBACK-RETRY",
    "SCN-DB-WORKBENCH-INSTRUMENT-RECOVERY",
    "SCN-DB-WORKBENCH-DECIMAL-SOURCE-SHAPE",
    "SCN-DB-WORKBENCH-CANONICAL-DIGEST",
    "SCN-DB-INVOCATION-NARROW-RELEASE-AUTHORITY",
    "SCN-DB-INVOCATION-RELEASE-IDENTITY-AND-FENCING",
    "SCN-DB-INVOCATION-EXPIRED-AND-TERMINAL-RETENTION",
    "SCN-DB-INVOCATION-TEMP-SHADOW-CANONICAL-STORAGE",
    "SCN-DB-INVOCATION-STALE-COMPLETION-RETENTION",
    "SCN-DB-PENDING-INDEX-KEYS-PREDICATE-AND-OWNERSHIP",
    "SCN-DB-PENDING-COUNTS-STATE-AND-TENANT-SCOPE",
    "SCN-DB-PENDING-COUNTS-EXPLAIN-1000-10000"
  ],
  "artifact_digests": [
    "sha256:6cdbf53a82197f61f3e13e421da6aa75ec0253e7b1f8d996f97b7893f2250d5e",
    "sha256:264ac36e29ca4329d8dec9452bd2088c4acc8eed15947634da1d246af3efa5fd",
    "sha256:019592b48b726e27c14b59afa655e8cdcd71ad68c8c1907988f5b86501deb0e6",
    "sha256:3ac44f5cd0ee7431a7462f54e4c874b31a37cec21e829027d94c3538deb7b15d",
    "sha256:4cfa2c2c9e74679a148907d05ae7376c26ce5f07c577e2c33a01c436f0509cbc"
  ],
  "observed_at": "2026-10-15T15:37:09Z",
  "performer_id": "GITHUB-ACTIONS-HOSTED-RUNNER",
  "reviewer_id": "CODEX-INDEPENDENT-INTEGRATION-REVIEW",
  "limitations": [
    "This successor establishes the named PostgreSQL 17.10 and Flyway 13.8.1 clean, V003-to-V007 upgrade, replay, privilege, tenant, custody, outbox, bounded-invocation and query-plan scenarios after the resource cleanup repair, at the exact source commit.",
    "The clean database suite passed 33 of 34 discovered tests; its upgrade-only skip passed in the separate upgrade suite, which passed all nine tests. Both named PostgreSQL jobs completed successfully.",
    "The source workflow completed with failure because its two Python metadata jobs correctly rejected the prior receipt binding for the changed runtime. This receipt records the successful database jobs. Successor receipt admission and the complete Python acceptance matrix receive their own subsequent validation; this observation supplies their source evidence.",
    "Hosted workbench restart scenarios reconstruct application objects. The separate resource-cleanup native PostgreSQL 17 receipt records actual database-process restart, immediate crash recovery and owned cleanup. Local fault-injection tests separately exercise interrupted cursor, connection and export release.",
    "Query-plan timing and buffer activity describe the normalized 1,000-specimen and 10,000-pending-message synthetic fixture. Representative workload distribution, concurrency and service objectives retain independent observations.",
    "The historical V005 and V007 hosted receipts, prior native recovery receipt and signed v0.3.2 release retain their original evidence and promotion states.",
    "Representative populated restore, backup/PITR, storage-corruption detection, power-loss behavior, replica and cloud failover, production security and observability, and accountable domain acceptance retain their existing successor owners.",
    "The verified synthetic observation supports engineering review. Production authorization remains with accountable environment owners."
  ]
}
