{
  "schema_version": "1.1.0",
  "receipt_id": "RECEIPT-HOSTED-POSTGRESQL-V007-001",
  "claim_id": "CLAIM-HOSTED-SYNTHETIC-DATABASE-BOUNDARIES",
  "intended_use_id": "INTENDED-USE-SYNTHETIC-REFERENCE",
  "release_claim_id": "RELEASE-CLAIM-IMPLEMENTATION-0.3.2",
  "evidence_mode": "observed",
  "assurance_stage": "verified",
  "environment": "github-hosted-synthetic-postgresql",
  "version_bindings": {
    "repository": "0.3.2",
    "repository_commit": "83889fa87b740d824e82f5c9ffb0c515e6823148",
    "workflow_run": "https://github.com/driftframestudios/lims-eln-enterprise-implementation/actions/runs/38627891331",
    "python": "3.12.15",
    "python_matrix": "3.12.15,3.13.16",
    "psycopg": "3.3.6",
    "postgresql": "17.10-alpine",
    "postgresql_image": "postgres:17.10-alpine@sha256:742f40ea20b9ff2ff31db5458d127452988a2164df9e17441e191f3b72252193",
    "database_migration_head": "007",
    "tenant_authority": "signed_short_lived_database_verified_context",
    "flyway": "13.8.1",
    "flyway_image": "flyway/flyway:13.8.1-alpine@sha256:ca3c8eddac25811f84c9767c56a0610ce23cd4e61f59bb05778a78db42347b39",
    "migration_authenticated_login": "laboratory_migrator",
    "migration_role": "laboratory_owner",
    "runner": "ubuntu-24.04",
    "workflow": ".github/workflows/ci.yml",
    "clean_job_id": "116071643534",
    "upgrade_job_id": "116071643361",
    "plan_observation_artifact": "receipts/postgresql-v007-plan-observations.json",
    "predecessor_receipt": "RECEIPT-HOSTED-POSTGRESQL-001"
  },
  "scenario_ids": [
    "SCN-DB-MIGRATION-CHECKSUM-REPLAY",
    "SCN-DB-MIGRATION-003-TO-007-UPGRADE-REPLAY",
    "SCN-DB-MIGRATION-004-PROVENANCE-GATE",
    "SCN-DB-SIGNED-TENANT-BOUNDARY",
    "SCN-DB-TENANT-CONTEXT-TAMPER-EXPIRY",
    "SCN-DB-CUSTODY-CAS-AND-ATOMIC-OUTBOX",
    "SCN-DB-SECURITY-DEFINER-TEMP-SHADOW",
    "SCN-DB-OUTBOX-CONTENT-IMMUTABILITY",
    "SCN-DB-OUTBOX-FENCED-CLAIM-RECLAIM-STALE-CONFIRM",
    "SCN-DB-OUTBOX-LEASE-DURATION-INTEGER-BOUND",
    "SCN-DB-OUTBOX-MESSAGE-IDENTITY-LIVENESS",
    "SCN-DB-OUTBOX-TRANSITION-AUTHORITY",
    "SCN-DB-OUTBOX-ATTEMPT-ACK-RECOVERY-EVIDENCE",
    "SCN-DB-OUTBOX-TRANSPORT-RECEIPT-UNIQUENESS",
    "SCN-DB-SCIENTIFIC-QUANTITY-EXACTNESS",
    "SCN-DB-VERIFICATION-KEY-CONFIDENTIALITY",
    "SCN-DB-FLYWAY-MIGRATOR-AUTHORITY",
    "SCN-DB-FLYWAY-ARTIFACT-INVENTORY",
    "SCN-DB-MIGRATION-CLEAN-UPGRADE-CONVERGENCE",
    "SCN-DB-MEASUREMENT-COMPLETE-LINEAGE",
    "SCN-DB-CUSTODY-COMPLETE-EVENT-BINDING",
    "SCN-DB-WORKBENCH-RESTART-RELOAD",
    "SCN-DB-WORKBENCH-REPLAY-COLLISION-ISOLATION",
    "SCN-DB-WORKBENCH-ROLLBACK-RETRY",
    "SCN-DB-WORKBENCH-INSTRUMENT-RECOVERY",
    "SCN-DB-WORKBENCH-DECIMAL-SOURCE-SHAPE",
    "SCN-DB-WORKBENCH-CANONICAL-DIGEST",
    "SCN-DB-INVOCATION-NARROW-RELEASE-AUTHORITY",
    "SCN-DB-INVOCATION-RELEASE-IDENTITY-AND-FENCING",
    "SCN-DB-INVOCATION-EXPIRED-AND-TERMINAL-RETENTION",
    "SCN-DB-INVOCATION-TEMP-SHADOW-CANONICAL-STORAGE",
    "SCN-DB-INVOCATION-STALE-COMPLETION-RETENTION",
    "SCN-DB-PENDING-INDEX-KEYS-PREDICATE-AND-OWNERSHIP",
    "SCN-DB-PENDING-COUNTS-STATE-AND-TENANT-SCOPE",
    "SCN-DB-PENDING-COUNTS-EXPLAIN-1000-10000"
  ],
  "artifact_digests": [
    "sha256:621df8cea31371df62de229c4b78d32f007efb0378eef3825bf16533e36c3a65",
    "sha256:264ac36e29ca4329d8dec9452bd2088c4acc8eed15947634da1d246af3efa5fd",
    "sha256:019592b48b726e27c14b59afa655e8cdcd71ad68c8c1907988f5b86501deb0e6",
    "sha256:b7d9255e186f065c9b3b211e6ca09feb513dd2282e1a71d70b8c48e10b8a8a2f",
    "sha256:4cfa2c2c9e74679a148907d05ae7376c26ce5f07c577e2c33a01c436f0509cbc"
  ],
  "observed_at": "2026-10-14T19:58:34Z",
  "performer_id": "GITHUB-ACTIONS-HOSTED-RUNNER",
  "reviewer_id": "CODEX-INDEPENDENT-INTEGRATION-REVIEW",
  "limitations": [
    "This receipt establishes the named hosted PostgreSQL 17.10 and Flyway 13.8.1 clean, V003-to-V007 upgrade, replay, privilege, tenant, custody, outbox, bounded-invocation and query-plan scenarios at the exact source commit.",
    "The clean database suite passed 33 of 34 discovered tests; its one upgrade-only skip passed in the separate upgrade suite, which passed all nine tests. Each base Python matrix job passed 315 of 361 tests with 46 explicit configured or optional-profile skips. The optional Program contracts profile retains its separate local observation.",
    "Hosted workbench restart scenarios reconstruct application objects. The separate owned PostgreSQL 17 recovery receipt records actual database-process restart, immediate crash recovery and cleanup.",
    "Query-plan timing and buffer activity describe the normalized 1,000-specimen and 10,000-pending-message synthetic fixture. Representative workload distribution, concurrency and service objectives retain independent observations.",
    "The historical V005 hosted receipt and signed v0.3.2 release retain their original evidence and promotion states. This receipt records the named post-release development source.",
    "Representative populated restore, backup/PITR, storage-corruption detection, power-loss behavior, replica and cloud failover, production security and observability, and accountable domain acceptance retain their existing successor owners.",
    "The verified synthetic observation supports engineering review. Production authorization remains with accountable environment owners."
  ]
}
