{
  "schema_version": "1.1.0",
  "receipt_id": "RECEIPT-OWNED-POSTGRESQL17-STREAM-OWNERSHIP-001",
  "claim_id": "CLAIM-OWNED-DATABASE-PROCESS-RECOVERY",
  "intended_use_id": "INTENDED-USE-SYNTHETIC-REFERENCE",
  "release_claim_id": "RELEASE-CLAIM-IMPLEMENTATION-0.3.2",
  "evidence_mode": "observed",
  "assurance_stage": "verified",
  "environment": "local-owned-synthetic-postgresql",
  "version_bindings": {
    "repository": "0.3.2",
    "repository_commit": "a35dbaae69e8488a976bc580b3ea90addf12a9b1",
    "python": "3.12.13",
    "postgresql": "17.10",
    "psycopg": "3.3.6",
    "postgresql_distribution": "official-source-build-with-openssl3-pgcrypto",
    "database_migration_head": "007",
    "migration_method": "psql_single_transaction_per_source_file",
    "tenant_authority": "signed_short_lived_database_verified_context",
    "runtime_and_harness_sha256": "19e2e1300fac95029a362ee0ce2519768149b00f211e9ce23b2e44d5852a8fd2",
    "observation_summary_sha256": "063d7a52d2aeb8cf167ba99885419281411810a1bbd556bc600bc0d3418d374b",
    "server_lifetimes": "3",
    "owned_clusters_cleaned": "3",
    "retained_public_tables": "20",
    "data_checksums": "off",
    "fsync": "on",
    "full_page_writes": "on",
    "synchronous_commit": "on",
    "wal_level": "replica",
    "postgresql_source_archive_sha256": "078a03516dcdbdb705fecaf415ea3d13a956c589e46f09fed68a06fb00598c90",
    "predecessor_receipt": "RECEIPT-OWNED-POSTGRESQL17-RESOURCE-CLEANUP-001"
  },
  "scenario_ids": [
    "SCN-DB-OWNED-FAST-RESTART",
    "SCN-DB-OWNED-IMMEDIATE-CRASH-RECOVERY",
    "SCN-DB-OWNED-PENDING-TRANSACTION-ROLLBACK",
    "SCN-DB-OWNED-RECONSTRUCTED-ADAPTER",
    "SCN-DB-OWNED-GOLDEN-REPLAY-ZERO-EFFECTS",
    "SCN-DB-OWNED-CUSTODY-RETRY-AND-REPLAY",
    "SCN-DB-OWNED-FAILURE-CLEANUP-AND-FRESH-REENTRY"
  ],
  "artifact_digests": [
    "sha256:19e2e1300fac95029a362ee0ce2519768149b00f211e9ce23b2e44d5852a8fd2",
    "sha256:063d7a52d2aeb8cf167ba99885419281411810a1bbd556bc600bc0d3418d374b",
    "sha256:0ebfb5ecf405130a28704322fb7140caad0b5dd25df6be07894d7aca55801584",
    "sha256:d0a8a360debb70f5dfdfcb8834ae8558a285e3f852014b91d9c521a2bd9ec7e4",
    "sha256:ed9f4f4f342eb133575c1e1920558427ae0044750c61885bee7d89d4ac8afe91",
    "sha256:13925ea70a930ef69240de8e0ffe56e5cb4479fb64e48cf41e6051dc8eb66a70",
    "sha256:2cb392ab1d59ce8db7cf163da221c09e898f65358462819f81ab29b558386b36",
    "sha256:6366a6093992c6fa42770cb5e6706a9109cbbcf2c0828f14bfe8af9288e0ed6e",
    "sha256:7e1f12134f5d00ce8b488ac6da37e86b89969d5051a4b6b47accd7217f359c94",
    "sha256:bcd2b1ef557cbff04f74780c6b0493102750e5dcff8477e0c8405eaf3cdf8c78",
    "sha256:078a03516dcdbdb705fecaf415ea3d13a956c589e46f09fed68a06fb00598c90"
  ],
  "observed_at": "2026-10-15T18:27:12.391574+00:00",
  "performer_id": "LOCAL-OWNED-POSTGRESQL-HARNESS",
  "reviewer_id": "CODEX-INDEPENDENT-INTEGRATION-REVIEW",
  "limitations": [
    "This successor records the seven named local database-process recovery scenarios after explicit export raw-stream ownership was added, at the exact observed source, engine, driver, migration and durability settings. Separate local real-I/O fault-injection tests establish buffered finalization, descriptor reuse, control precedence and retained-resource recovery.",
    "Migrations V001 through V007 ran as explicit source SQL transactions. The retained resource-cleanup hosted receipt records PostgreSQL 17 and Flyway evidence for its own source; its bound database artifacts remain unchanged in this export-only repair.",
    "The observed PostgreSQL 17.10 cluster used data_checksums=off. Storage-corruption detection, power-loss behavior, backup/PITR, replica and cloud failover retain separate observations.",
    "The harness materializes a small synthetic fixture across 20 public tables. Representative workload cost and production recovery objectives retain their own observations.",
    "The signed v0.3.2 release, historical V005/V007 hosted receipts and earlier native recovery/resource-cleanup receipts retain their original evidence. Accountable Engineering, Security, Operations, Scientific, Quality and Regulatory acceptance remains with the named environment owners.",
    "Private build, connection, log and resource coordinates remain with the local execution owner; the normalized source and observation digests preserve the evidence boundary."
  ]
}
