{
  "schema_version": "1.1.0",
  "receipt_id": "RECEIPT-LOCAL-REFERENCE-001",
  "claim_id": "CLAIM-LOCAL-SYNTHETIC-PROOF-FLOOR",
  "intended_use_id": "INTENDED-USE-SYNTHETIC-REFERENCE",
  "release_claim_id": "RELEASE-CLAIM-IMPLEMENTATION-0.3.1",
  "evidence_mode": "observed",
  "assurance_stage": "verified",
  "environment": "local-synthetic-reference",
  "version_bindings": {
    "repository": "0.3.1",
    "python": "3.12+",
    "fixture_profile": "synthetic-v1",
    "governance_schema": "2.0.1",
    "control_plane_profile": "0.3.0",
    "postgresql": "17.10",
    "database_migration_head": "004",
    "tenant_authority": "signed_short_lived_database_verified_context"
  },
  "scenario_ids": [
    "SCN-LIFECYCLE-REPLAY",
    "SCN-INSTRUMENT-QUARANTINE",
    "SCN-VENDOR-AMBIGUOUS-READBACK",
    "SCN-MIGRATION-RESTORE",
    "SCN-BOUNDED-CALLER-READ",
    "SCN-BOUNDED-CALLER-NARROW-WRITE",
    "SCN-BOUNDED-CALLER-BROAD-WRITE",
    "SCN-BOUNDED-CALLER-FAILURE-TWINS"
  ],
  "artifact_digests": [
    "sha256:a1a6601d0e5469b797b48a929ce4552d62666aab3f314df6a1e0fbedfc01341d",
    "sha256:0ada7268fe0b4ea308e36a2ba56c5f9e80d6cda7916a34a5e1ddaab7e003332f",
    "sha256:4c2cb27eeb848c63878da5d8d3512b8d6d5f3544ba4b1a22415038776965eaa9"
  ],
  "observed_at": "2026-08-04T12:00:00Z",
  "performer_id": "SYN-AUTOMATION-RUNNER",
  "reviewer_id": "SYN-INDEPENDENT-REVIEWER",
  "limitations": [
    "This local receipt verifies the synthetic implementation and grants no production authorization.",
    "The selected-future simulation closes the four substantive families under its own modeled authority and evidence boundary.",
    "Configured-environment observation and organizational acceptance remain independent successor receipts."
  ]
}
